{"bestDirection":"higher","metricName":"novelty_score","metricUnit":"pts","name":"ADAS Radar Perception, TinyML Micro-Kernels, HPCC Parallelization & Generative Resimulation","type":"config"}
{"commit":"e2673d8","description":"baseline: env audit + field map (CEER HDF5 verified, 124-row MF4 manifest, N2-N8 frontier, E1-E7)","metric":55.0,"metrics":{"contrast_score":0,"prior_art_clear":1,"proof_strength":0,"sota_gap_pct":0},"run":1,"segment":0,"status":"keep","timestamp":1758860000}
{"commit":"f741d8b","description":"T1 dual-loop CFAR: edge-skirt recall 0.50->1.00 FA 1->0; novelty search: OFPI-CFAR https://www.jpier.org/ac_api/download.php?id=15091603, VI/LSTM-CFAR https://www.radioeng.cz/fulltexts/2025/25_01_0132_0142.pdf, IQR-CFAR S1874490724001149 -> lineage exists; evidence: resim_research/dual_loop_cfar.py demo PASS","metric":62.0,"metrics":{"contrast_score":55,"prior_art_clear":0,"proof_strength":70,"sota_gap_pct":100.0},"run":2,"segment":0,"status":"discard","timestamp":1758860000}
{"commit":"cdc4890","description":"T2 rank-1 specular displacement theorem: p-p_s=2d*n EXACT to 1.066e-14 (2000 samples), range/velocity/bearing-independent. Naive mirror-image ghost model REFUTED: range-exact (0.0m) but bearing-wrong 15.189deg = 8.000m @30.3m (half-correct failure). Ghost Doppler=u_s.v, offset -1.987m/s = 40 sigma. Ghost = virtual aperture: assimilation pos RMSE 3.242->0.739m (-77.2%, 4.39x); R_eff=diag+J_xi Sig_xi J_xi^T with gauge-respecting Sig_n=s_n^2(I-nn^T) = +13.2% over naive diag(R) at 2deg/0.15m. Ghost-pair extraction (40 scans,20 dets, sr=0.10m, saz=0.35deg): 3-DOF recall 0.993/prec 0.909/2d_err 0.077m; 1-DOF 0.845/0.727/0.618 REFUTED by own baseline. Blockers measured: curved guardrail 2D sweeps 132m=1320x noise, recall->0.450; geometric test provably blind to same-range pair at exactly 2d (prec 0.638). Novelty (2 parallel sub-agents): invariant NOT in any fetched source; ghost-as-aperture NOT published; automotive ghost line (Kamon/Chong/Vockers ~2015 RadarConf) rejects, never assimilates; closest Li & Varshney IEEE TSP ~2014 >250 cites https://ieeexplore.ieee.org/search/searchresult.jsp?queryText=%22Multipath+exploitation+for+target+localization%22 ; arXiv 2312.11148 uses multipath for height only, no virtual aperture. CAVEAT: Semantic Scholar 429 both agents, citedByCount unverified (citation bar NOT fully met; contribution rests on first-principles unfolding not a cited mechanism). Evidence: experiments/run-3.log + equations.md E2a-E2e","metric":74.0,"metrics":{"contrast_score":78,"prior_art_clear":1,"proof_strength":80,"sota_gap_pct":77.2},"run":3,"segment":0,"status":"keep","timestamp":1790427159}
{"commit":"5256da9","description":"N11 track-velocity Doppler gate resolves N9 decoy blind spot: decoy prec 0.638->0.877 (+0.239), GRR 0.661, recall cost<=0.009; novelty: ICSIDP2024 doi 10.1109/icsidp62679.2024.10868429 + Roos/Daimler d-nb.info/1212452852/34 publish Doppler ghost filtering -> lineage exists; evidence: resim_research/doppler_disambiguation.py demo PASS","metric":63.0,"metrics":{"contrast_score":58,"prior_art_clear":0,"proof_strength":72,"sota_gap_pct":66.1},"run":4,"segment":0,"status":"discard","timestamp":1790427159}
{"commit":"f13469e","description":"T3 async motion extrapolation: 2-sat U[5,45]ms residual cut 86/76/65/54/43/32% over w=0.1..0.6; sign challenge R(-wdt) refuted (-26%); swarm sweep CLEAR (IET 10.1049/rsn2.12693, IEEE 5940472/10978756 adjacent only); deskewing paradigm exists in lidar -> contrast capped; evidence: resim_research/async_motion_compensation.py demo PASS","metric":68.0,"metrics":{"contrast_score":62,"prior_art_clear":1,"proof_strength":70,"sota_gap_pct":54.0},"run":5,"segment":0,"status":"discard","timestamp":1790427159}
{"commit":"fa2baaf","description":"T4 kinematics-aware adaptive gate: cut-in recall 0.863->0.996, RMSE 0.283->0.212m (3 clutter/scan); open-door fault caught+answered via RMSE; swarm CLEAR (IEEE 11699489/10726762 adaptive-Q only, no accel+innovation gate); ISO-bounded determinism; evidence: resim_research/adaptive_gating.py demo PASS","metric":71.0,"metrics":{"contrast_score":68,"prior_art_clear":1,"proof_strength":75,"sota_gap_pct":15.4},"run":6,"segment":0,"status":"keep","timestamp":1790427159}
{"commit":"71817be","description":"T5 spectral covariance scaling: spray RMSE 0.911->0.315m (-65%), Joseph PD minEig>0 all frames; swarm CLEAR (arXiv 2603.18027 adaptive-R adjacent); Sage-Husa lineage caps contrast; evidence: resim_research/spectral_covariance_scaling.py demo PASS","metric":67.0,"metrics":{"contrast_score":60,"prior_art_clear":1,"proof_strength":70,"sota_gap_pct":65.4},"run":7,"segment":0,"status":"discard","timestamp":1790427159}
{"commit":"71112c5","description":"F Doppler-RadarSplat MVP: R4 exact 256.0, Jacobians vs FD 1e-9, CDC recovery 6/6 clean+cluttered (0.053m/0.036m/s); CLEAN+noise-floor fixes for near-far masking; swarm D CLEAR (NeuRadar gap confirmed 2504.00859); evidence: resim_research/doppler_radarsplat_mvp.py demo PASS","metric":70.0,"metrics":{"contrast_score":70,"prior_art_clear":1,"proof_strength":72,"sota_gap_pct":100.0},"run":8,"segment":0,"status":"keep","timestamp":1790427159}
{"commit":"e4c233a","description":"Phase-4 harness: HDF5->KPI-CSV bridge + candidate MF4 wrapper; production KPI script runs: identity Accuracy 100.0, +20mm bias Accuracy 0.0 w/ Tier-1 yield 100%; MF4 round-trip exact; evidence: resim_research/hdf5_to_kpi_csv.py, candidate_mf4.py, kpi_work/","metric":60.0,"metrics":{"contrast_score":50,"prior_art_clear":1,"proof_strength":80,"sota_gap_pct":0.0},"run":9,"segment":0,"status":"keep","timestamp":1790427159}
{"commit":"7bb174a","description":"HDF-KPI verification: NEW UDP HDF KPI direct-call 100.00% (50/50) veh-vs-output; identity candidate 100%, +20mm bias Tier-1 100% (Tier-2 fails per CSV path); CAN HDF KPI schema-mismatch documented (Bordnet HDF vs HEADER_STREAM flavor); SiL exe UNBUILDABLE locally (no MSVC, VS2015 gen, jfrog token); ideas backlog N13-N18; evidence: kpi_work/udp_hdf_out, autoresearch_research.ideas.md","metric":60.0,"metrics":{"contrast_score":50,"prior_art_clear":1,"proof_strength":80,"sota_gap_pct":0.0},"run":10,"segment":0,"status":"keep","timestamp":1790427159}
{"commit":"7306464","description":"N8 prefix-scan KF: Lemma-7 elements (naive construction refuted 0.1@step1), Blelloch order fixed; assoc rel 6.35e-15; scan==seqKF to 1.5e-10@50k; span 16 vs 50000 steps; float64 mandate; evidence: resim_research/parallel_kf.py demo PASS","metric":64.0,"metrics":{"contrast_score":58,"prior_art_clear":1,"proof_strength":75,"sota_gap_pct":99.97},"run":11,"segment":0,"status":"discard","timestamp":1790427159}
{"commit":"fcb56f6","description":"N10 Fermat cylinder RANSAC: curved rec 0.198->0.753 prec 0.220->0.834; midpoint-surface invariant REFUTED; single-scan fit ambiguous (45,3) 31/40; prior art: Fu2024 tangential, Chen2024 guardrail, Jost2025 surface, Ulm wall-RANSAC; evidence: resim_research/bend_conditioned.py demo PASS","metric":63.0,"metrics":{"contrast_score":58,"prior_art_clear":0,"proof_strength":72,"sota_gap_pct":280.0},"run":12,"segment":0,"status":"discard","timestamp":1790427159}
{"commit":"3207679","description":"N12 coarse-to-fine joint search: recall 0.965/prec 0.862/2d_med 0.083m at 18.2% of 3-DOF evals; 30-dir coarse CULLS truth (fixed by 100-dir+20deg gate); mean-2d fragility documented; 1-DOF re-confirmed 0.845; evidence: resim_research/hybrid_consensus.py demo PASS","metric":61.0,"metrics":{"contrast_score":55,"prior_art_clear":0,"proof_strength":72,"sota_gap_pct":14.2},"run":13,"segment":0,"status":"discard","timestamp":1790427159}
{"commit":"8114bb0","description":"N18 closed ghost chain (estimate->gate->assimilate, ESTIMATED xi): edges 0.000/0.000->0.969/0.902, track RMSE 1.969->0.651m (-67%), est err 0.26m/3.28deg; old baseline vacuous on moving scenes; evidence: resim_research/combined_chain.py demo PASS","metric":80.0,"metrics":{"contrast_score":75,"prior_art_clear":1,"proof_strength":82,"sota_gap_pct":67.0},"run":14,"segment":0,"status":"keep","timestamp":1790427159}
{"commit":"6a022d1","description":"N14 track-conditioned residual estimator + INT8 head: range RMSE 0.439->0.106->0.108m, 4.5x fewer mults; beat-is-range fault caught+reframed; lag-1 beats FFT 4x; prior art arXiv:2609.30176; evidence: resim_research/track_conditioned.py demo PASS","metric":65.0,"metrics":{"contrast_score":58,"prior_art_clear":0,"proof_strength":72,"sota_gap_pct":75.9},"run":15,"segment":0,"status":"discard","timestamp":1790427159}
{"commit":"0d12b38","description":"N15 conformal gate: unmodeled-maneuver coverage 0.042->0.996, RMSE 17.7->0.263m; outlier-regime fault caught (fixed wins there); OOS sensor shares gate; evidence: resim_research/conformal_fusion.py demo PASS","metric":67.0,"metrics":{"contrast_score":60,"prior_art_clear":0,"proof_strength":75,"sota_gap_pct":98.5},"run":16,"segment":0,"status":"discard","timestamp":1790427159}
{"commit":"b99328e","description":"HPCC fast-DA A+B+B+: real boresight az -1.145 extracted+injected; dual-horizon lock 46 vs 400cap (8.7x); ghost-normal coarse seed 1.146deg (physics floor proven); evidence: resim_research/fast_da.py demo PASS","metric":70.0,"metrics":{"contrast_score":66,"prior_art_clear":1,"proof_strength":75,"sota_gap_pct":88.5},"run":17,"segment":0,"status":"keep","timestamp":1790427159}
{"commit":"b99328e","description":"Synthetic 4-scenario generator (production HDF schema) + halo replay orchestrator: synth overpass KPI identity 100.0/bias 0.0; replay drops 360k->914 (394x)->0; evidence: synthetic_generator.py, hpcc_local_orchestrator.py PASS","metric":60.0,"metrics":{"contrast_score":50,"prior_art_clear":1,"proof_strength":80,"sota_gap_pct":0.0},"run":18,"segment":0,"status":"keep","timestamp":1790427159}
{"commit":"78d4ba9","description":"N19 driving ghost alignment: tight-magnitude-cluster + median holds 0.955deg at scan60 (13.0->1.7->0.96); mean/median/gated/vote/EM fusions all fail on lattice strays (documented); evidence: resim_research/ego_ghost_alignment.py demo PASS","metric":67.0,"metrics":{"contrast_score":60,"prior_art_clear":1,"proof_strength":75,"sota_gap_pct":16.6},"run":19,"segment":0,"status":"discard","timestamp":1790427159}
{"commit":"8d301eb","description":"N16 ghost-conditioned augmentation: clean-tuned FA 0.425 on multipath vs aug-tuned 0.033, recall 1.000; normalized peak stat removes R4 spread; evidence: resim_research/ghost_augmentation.py demo PASS","metric":64.0,"metrics":{"contrast_score":58,"prior_art_clear":0,"proof_strength":70,"sota_gap_pct":92.2},"run":20,"segment":0,"status":"discard","timestamp":1790427159}
{"commit":"8d301eb","description":"N17 censored sector pooling: sparse-regime MSE 56.4->30.4 (1.86x); fixed sectors REFUTED (boundary bias); median-LN2 + in-pool censoring; evidence: resim_research/sector_clutter_map.py demo PASS","metric":58.0,"metrics":{"contrast_score":52,"prior_art_clear":0,"proof_strength":70,"sota_gap_pct":46.1},"run":21,"segment":0,"status":"discard","timestamp":1790427159}
{"run": 22, "commit": "3abd7a9", "metric": 68.0, "metrics": {"contrast_score": 66, "prior_art_clear": 0, "proof_strength": 78, "sota_gap_pct": 0.0}, "status": "discard", "description": "N20g tangent-mirror Hermite cubic: coeff rel-err 3.44e-14 exact, 5.2e-3 @0.02m noise; gate crude (documented); novelty search: MATLAB ghost sim/MITRE height-from-multipath/Zheng-GLRT detect-only, no Hermite-from-ghost art surfaced (full-text clearance PENDING); evidence: resim_research/hermite_clothoid.py demo PASS", "timestamp": 1790759362, "segment": 0}
{"run": 23, "commit": "3abd7a9", "metric": 62.0, "metrics": {"contrast_score": 60, "prior_art_clear": 0, "proof_strength": 80, "sota_gap_pct": 80.3}, "status": "discard", "description": "N22g Occupancy-BLUE: Pfa 1.02e-4 vs 1e-4 (1e6 trials), var 0.0686 vs CA16 bias +37.5pct; lineage SOW-CFAR/AWTS-CFAR weighted variants + tracker-aided detection; evidence: resim_research/occupancy_blue.py demo PASS", "timestamp": 1790759362, "segment": 0}
{"run": 24, "commit": "3abd7a9", "metric": 60.0, "metrics": {"contrast_score": 62, "prior_art_clear": 0, "proof_strength": 78, "sota_gap_pct": 0.0}, "status": "discard", "description": "N27 yaw-free clock (tau/b exact 1e-12, RMSE 6.6/3.8ms) + N26 contact inverse (t=5 exact, RMSE 0.018m); temporal-calibration literature (Kim25/Stironja26/Lee23) + Fermat-flow inverse art; evidence: yawfree_clock.py + specular_contact.py demo PASS", "timestamp": 1790759362, "segment": 0}
{"run": 25, "commit": "3abd7a9", "metric": 60.0, "metrics": {"contrast_score": 60, "prior_art_clear": 0, "proof_strength": 75, "sota_gap_pct": 0.0}, "status": "discard", "description": "N28 guarded replay (300/300 assoc, enclosure-only fixed-pt) + N21g Gram lift (closure 5.9e-13, scan <1e-9); replay/checkpoint patents + polynomial-filter/parallel-IEKS lineage; evidence: guarded_replay.py + gram_lift.py demo PASS", "timestamp": 1790759362, "segment": 0}
{"run": 26, "commit": "3abd7a9", "metric": 57.0, "metrics": {"contrast_score": 55, "prior_art_clear": 0, "proof_strength": 80, "sota_gap_pct": 0.0}, "status": "discard", "description": "N23 three-product residual tracker: stencil/fixedpt/noise exact (RMSE 13.13mm = theory), 3-product count instrumented; DIRECT prior art TCRE arXiv:2609.30176 (four coherent sums); evidence: resim_research/n23_residual_track.py demo PASS", "timestamp": 1790759362, "segment": 0}
{"run": 27, "commit": "3abd7a9", "metric": 63.0, "metrics": {"contrast_score": 62, "prior_art_clear": 0, "proof_strength": 82, "sota_gap_pct": 0.0}, "status": "discard", "description": "N24 contamination-budgeted rank gate: sandwich exact, inclusion holds to 1e9 mag, cut-in contained, coverage lower95>=0.89 all 3 populations, sliding gate poisons 19x while frozen fixed; Bashari-ICML25 contaminated-conformal prior art; evidence: resim_research/n24_rank_gate.py demo PASS", "timestamp": 1790759362, "segment": 0}
{"run": 28, "commit": "3abd7a9", "metric": 58.0, "metrics": {"contrast_score": 60, "prior_art_clear": 0, "proof_strength": 80, "sota_gap_pct": 0.0}, "status": "discard", "description": "N25 ghost-difference yaw: exact scene 1e-10, cert 0.071deg @0.5mm, 0.35deg-noise refuses (27deg), adversary in-cert, curve/swap/singular refused, replay bit-identical; ghost-ID literature dense (MP-IAA/Roos/Kraus/Lee23); sub-0.1deg/1s UNVALIDATED; evidence: resim_research/n25_ghost_yaw.py demo PASS", "timestamp": 1790759362, "segment": 0}
{"run": 29, "commit": "3abd7a9", "metric": 55.0, "metrics": {"contrast_score": 52, "prior_art_clear": 0, "proof_strength": 78, "sota_gap_pct": 0.0}, "status": "discard", "description": "N15 IMM accel gate REFUTED standalone: IMM-pure 0.880 vs N5 0.999 (onset chicken-and-egg, k-sweep flat), hybrid==N5 (grounding adds nothing); IMM textbook lineage (JHU-APL/MATLAB/SAFE-IMM); evidence: resim_research/imm_accel_gate.py demo PASS", "timestamp": 1790759362, "segment": 0}
{"run": 30, "commit": "3abd7a9", "metric": 62.0, "metrics": {"contrast_score": 58, "prior_art_clear": 0, "proof_strength": 78, "sota_gap_pct": 0.0}, "status": "discard", "description": "Support studies: N22g closed loop (recall 0.166 vs 0.092, FA near-nominal, gain 0.099 stable) + N21g filter compare (decoupled-pos 1.24x, joint-spd 1.25x EKF; joint-pos 6.77x REFUTED, near-null amplification, oracle-controlled; depth 14 vs 100); evidence: blue_closed_loop.py + gram_filter_compare.py demo PASS", "timestamp": 1790759362, "segment": 0}
